<?xml version="1.0" encoding="UTF-8"?>
<?xml-stylesheet type="text/xsl" href="estilos.xsl"?>
<!DOCTYPE catalogonoticias SYSTEM "datos.dtd">
<catalogonoticias version="2.0">

  <noticia id="nba-101" categoria="playoffs" destacado="true">
    <titulo>Finales NBA 2026: Batalla Épica en el Séptimo Juego por el Anillo de Campeón</titulo>
    <fecha>2026-06-18</fecha>
    <autor>Carlos Mendoza</autor>
    <resumen>Una actuación histórica en los últimos segundos define el título de la NBA en una serie de playoffs inolvidable llena de tensión y estrategia de alto nivel.</resumen>
    <contenido>El séptimo partido de las finales ofreció un espectáculo inolvidable para los fanáticos del baloncesto mundial. Con una defensa asfixiante en los últimos dos minutos y un triple decisivo faltando 4 segundos, el equipo coronó una temporada impecable en el baloncesto profesional estadounidense.

La serie completa fue un reflejo del más alto nivel competitivo que la NBA puede ofrecer. Desde el primer partido, donde el equipo visitante sorprendió con una victoria en la carretera, hasta el dramático cierre en el séptimo juego, cada encuentro mantuvo a millones de espectadores al borde de sus asientos.

El jugador clave del partido decisivo registró 38 puntos, 12 rebotes y 8 asistencias, una línea estadística que será recordada durante generaciones. Su capacidad para tomar el control en los momentos más críticos demostró por qué es considerado uno de los mejores de su generación.

La defensa fue el factor diferenciador en los últimos minutos. El equipo campeón logró forzar tres pérdidas de balón consecutivas cuando el marcador estaba empatado a 104, convirtiendo cada una en puntos de transición rápida que sellaron el destino del partido.

Los analistas coinciden en que esta serie de finales pasará a la historia como una de las cinco mejores en la historia de la liga, comparándola con las icónicas batallas entre Lakers y Celtics en los años 80 y las legendarias Finales de 2016.

El trofeo Larry O'Brien fue entregado en una emotiva ceremonia en el centro de la cancha, donde los jugadores celebraron con lágrimas de alegría y abrazos con sus familias, culminando meses de sacrificio y dedicación absoluta al deporte.</contenido>
    <imagen>assets/images/nba_playoffs.jpg</imagen>
    <lecturaMinutos>5</lecturaMinutos>
    <etiquetas>
      <etiqueta>Playoffs</etiqueta>
      <etiqueta>FinalesNBA</etiqueta>
      <etiqueta>Campeones</etiqueta>
    </etiquetas>
  </noticia>

  <noticia id="nba-102" categoria="mvp" destacado="true">
    <titulo>Anuncio Oficial del MVP 2026: Dominio Total y Récords Rotos en la Liga</titulo>
    <fecha>2026-05-24</fecha>
    <autor>Sofia Ramírez</autor>
    <resumen>Con promedios astronómicos de triple-doble y liderando a su franquicia al mejor récord de la temporada regular, el premio al Jugador Más Valioso fue otorgado por unanimidad.</resumen>
    <contenido>La votación oficial de la prensa deportiva confirmó lo que se vio en la cancha durante toda la fase regular. El estelar base registró actuaciones memorables, rompiendo marcas históricas de efectividad en tiros de campo y asistencias.

Con promedios de 32.4 puntos, 11.2 asistencias y 8.7 rebotes por partido, el ganador del MVP estableció un nuevo estándar de excelencia individual combinada con éxito colectivo. Su equipo terminó con el mejor récord de la liga, una marca de 65-17 que no se veía desde hace más de una década.

Lo que hace especialmente notable esta temporada es la eficiencia. Con un 52.3% de tiros de campo, un 41.8% desde la línea de tres puntos y un 89.1% en tiros libres, se convirtió en el primer jugador en la historia de la NBA en promediar más de 30 puntos con un verdadero porcentaje de tiro (TS%) superior al 65%.

Los momentos más memorables de la temporada incluyen una racha de 15 triples dobles consecutivos en febrero, un partido de 58 puntos contra uno de los principales rivales de conferencia, y un récord de asistencias en un solo cuarto con 12 pases de gol en el tercer periodo contra los visitantes.

La ceremonia de entrega del premio contó con la presencia de leyendas de la liga, quienes reconocieron públicamente que están presenciando a uno de los jugadores más completos que jamás haya pisado una cancha de la NBA.

El impacto del MVP trasciende las estadísticas individuales. Su liderazgo transformó la cultura del equipo, convirtiendo a una franquicia que no había ganado más de 45 partidos en cinco años en el dominador absoluto de la temporada regular.</contenido>
    <imagen>assets/images/nba_mvp.jpg</imagen>
    <lecturaMinutos>4</lecturaMinutos>
    <etiquetas>
      <etiqueta>MVP</etiqueta>
      <etiqueta>PremiosNBA</etiqueta>
      <etiqueta>Records</etiqueta>
    </etiquetas>
  </noticia>

  <noticia id="nba-103" categoria="draft" destacado="false">
    <titulo>NBA Draft 2026: La Primera Selección Promete Revolucionar la Liga</titulo>
    <fecha>2026-06-25</fecha>
    <autor>Alejandro Silva</autor>
    <resumen>Las futuras estrellas del baloncesto universitario e internacional conocen sus nuevos destinos en una noche llena de sorpresas e intercambios estratégicos.</resumen>
    <contenido>El Barclays Center fue escenario de una jornada electrizante donde la primera selección global desató la ovación del público. Con una envergadura impresionante y un tiro exterior desarrollado a la perfección, este prospecto está listo para impactar desde el primer día.

El número uno del draft, un ala-pívot de 2.08 metros proveniente de la universidad más dominante del baloncesto colegial, fue descrito por los scouts como "el prospecto más completo desde hace una generación". Su combinación de tamaño, habilidad perimetral y visión de juego lo convierte en una pieza transformadora para cualquier franquicia.

Los intercambios de picks marcaron la noche. Tres traspasos se concretaron antes de la selección número 10, reorganizando completamente el panorama del draft. La jugada más sorpresiva fue el intercambio que llevó a un equipo de la Conferencia Oeste a subir del puesto 14 al 5, cediendo dos futuras primeras rondas y un jugador joven con potencial de All-Star.

Los analistas internacionales destacaron la presencia de cinco jugadores nacidos fuera de Estados Unidos entre las primeras 15 selecciones, confirmando la tendencia de globalización que la NBA ha experimentado en la última década. Jugadores de Francia, Serbia, Australia, Canadá y Nigeria fueron seleccionados en la lotería.

La segunda ronda no estuvo exenta de historias emotivas. Un jugador que fue rechazado por tres universidades antes de encontrar su lugar en una escuela pequeña fue seleccionado en el puesto 35, generando una de las reacciones más virales de la noche cuando abrazó a su madre entre lágrimas.

Los equipos ya comenzaron a planificar las ligas de verano donde estos rookies tendrán su primera oportunidad de demostrar su talento en un escenario profesional.</contenido>
    <imagen>assets/images/nba_draft.jpg</imagen>
    <lecturaMinutos>6</lecturaMinutos>
    <etiquetas>
      <etiqueta>Draft2026</etiqueta>
      <etiqueta>Rookies</etiqueta>
      <etiqueta>FuturoNBA</etiqueta>
    </etiquetas>
  </noticia>

  <noticia id="nba-104" categoria="fichajes" destacado="false">
    <titulo>Mega Traspaso Sacude el Mercado de Agentes Libres en la Conferencia Oeste</titulo>
    <fecha>2026-07-02</fecha>
    <autor>Javier Torres</autor>
    <resumen>Múltiples All-Stars cambian de camiseta en un acuerdo de tres equipos que altera drásticamente el equilibrio de poder para la próxima campaña.</resumen>
    <contenido>En uno de los movimientos más audaces de los últimos años, tres franquicias llegaron a un acuerdo multijugador que incluye varias elecciones de primera ronda del draft y veteranos consolidados.

El traspaso involucra a un total de siete jugadores y cuatro selecciones de primera ronda del draft. El equipo que se posiciona como el gran ganador adquirió a dos All-Stars complementarios que, junto a su estrella actual, forman un tridente ofensivo que los analistas califican como "potencialmente imparable".

Las cifras del acuerdo son astronómicas: más de 280 millones de dólares en salarios combinados se movieron entre las tres franquicias, convirtiendo este traspaso en el más grande en términos de valor salarial en la historia de la liga.

El mercado de agentes libres se vio inmediatamente afectado. Varios jugadores que esperaban ofertas máximas vieron cómo sus posibles destinos se reducían dramáticamente, forzando a sus agentes a reconsiderar las estrategias de negociación para el resto del verano.

Los expertos en techo salarial señalan que este movimiento tendrá implicaciones fiscales significativas. Al menos dos de los tres equipos involucrados superarán el segundo nivel del impuesto de lujo, pagando penalidades que podrían alcanzar los 150 millones de dólares adicionales en la próxima temporada.

La reacción de los fanáticos fue mixta pero intensa. Las redes sociales se inundaron con análisis, memes y predicciones sobre cómo este movimiento cambiará el panorama competitivo de la Conferencia Oeste, donde al menos cuatro equipos ahora se consideran legítimos contendientes al título.</contenido>
    <imagen>assets/images/nba_hero_banner.jpg</imagen>
    <lecturaMinutos>4</lecturaMinutos>
    <etiquetas>
      <etiqueta>AgenciaLibre</etiqueta>
      <etiqueta>Traspasos</etiqueta>
      <etiqueta>MercadoNBA</etiqueta>
    </etiquetas>
  </noticia>

  <noticia id="nba-105" categoria="general" destacado="false">
    <titulo>Nuevas Reglas Arbitrales y Uso de Tecnología IA en la NBA 2026-2027</titulo>
    <fecha>2026-07-15</fecha>
    <autor>Elena Gómez</autor>
    <resumen>La junta de gobernadores de la NBA aprueba ajustes en las faltas ofensivas y sistemas de revisión instantánea para agilizar el ritmo de los partidos.</resumen>